{
  "$schema": "https://json-schema.org/draft/2020-12/schema",
  "title": "Lynx results handoff v3",
  "type": "object",
  "properties": {
    "schema_version": {
      "enum": ["3.0", "3.1"]
    },
    "run_id": {
      "type": "string",
      "minLength": 1
    },
    "data_kind": {
      "enum": [
        "sample",
        "simulation"
      ]
    },
    "seed": {
      "type": "integer",
      "minimum": 0
    },
    "revision_round": {
      "type": "integer",
      "minimum": 0,
      "maximum": 3
    },
    "config": {
      "type": "object",
      "properties": {
        "schema_version": {
          "enum": ["2.0", "2.1"]
        },
        "run_id": {
          "type": "string",
          "minLength": 1
        },
        "purpose": {
          "const": "synthetic_experiment"
        },
        "seed": {
          "type": "integer",
          "minimum": 0
        },
        "duration_months": {
          "type": "integer",
          "minimum": 1
        },
        "start_month": {
          "type": "integer",
          "minimum": 1,
          "maximum": 12
        },
        "parameters_csv": {
          "type": "string",
          "minLength": 1
        },
        "parameters_sha256": {
          "type": "string",
          "pattern": "^[0-9a-f]{64}$"
        },
        "sources_csv": {
          "type": "string",
          "minLength": 1
        },
        "sources_sha256": {
          "type": "string",
          "pattern": "^[0-9a-f]{64}$"
        },
        "initial_population": {
          "type": "object",
          "properties": {
            "females": {
              "type": "integer",
              "minimum": 0
            },
            "males": {
              "type": "integer",
              "minimum": 0
            },
            "age_months_min": {
              "type": "integer",
              "minimum": 0
            },
            "age_months_max": {
              "type": "integer",
              "minimum": 0
            }
          },
          "required": [
            "females",
            "males",
            "age_months_min",
            "age_months_max"
          ],
          "additionalProperties": false
        },
        "patches": {
          "type": "array",
          "items": {
            "type": "object",
            "properties": {
              "id": {
                "type": "string",
                "minLength": 1
              },
              "area_km2": {
                "type": "number",
                "exclusiveMinimum": 0
              },
              "habitat_quality": {
                "type": "number",
                "minimum": 0,
                "maximum": 1
              }
            },
            "required": [
              "id",
              "area_km2",
              "habitat_quality"
            ],
            "additionalProperties": false
          },
          "minItems": 2,
          "maxItems": 2
        },
        "food_rabbits_per_ha": {
          "type": "number",
          "minimum": 0
        },
        "persistence_rule": {
          "const": "settled_breeding_pair_same_patch_at_end"
        },
        "model_conventions": {
          "const": "proposed-2026-10-22"
        },
        "male_patch_crossing_probability": {
          "type": "number",
          "minimum": 0,
          "maximum": 1
        },
        "settlement_rule": {
          "description": "Provisional female settlement rule used for this run.",
          "enum": [
            "monthly_current_then_other",
            "monthly_own_patch_only",
            "one_try_at_dispersal"
          ]
        },
        "parameter_overrides": {
          "type": "object",
          "properties": {
            "annual_mortality_rate_all_causes": {
              "type": "number",
              "minimum": 0.1,
              "maximum": 0.5
            },
            "female_home_range_km2": {
              "type": "number",
              "minimum": 4,
              "maximum": 30
            },
            "rabbit_density_spring_min_for_territorial_breeding": {
              "type": "number",
              "minimum": 3,
              "maximum": 6
            }
          },
          "additionalProperties": false
        }
      },
      "required": [
        "schema_version",
        "run_id",
        "purpose",
        "seed",
        "duration_months",
        "start_month",
        "parameters_csv",
        "parameters_sha256",
        "sources_csv",
        "sources_sha256",
        "initial_population",
        "patches",
        "food_rabbits_per_ha",
        "persistence_rule",
        "model_conventions",
        "male_patch_crossing_probability",
        "parameter_overrides"
      ],
      "additionalProperties": false
    },
    "history": {
      "type": "array",
      "items": {
        "type": "object",
        "properties": {
          "month": {
            "type": "integer",
            "minimum": 0
          },
          "population": {
            "type": "integer",
            "minimum": 0
          },
          "females": {
            "type": "integer",
            "minimum": 0
          },
          "males": {
            "type": "integer",
            "minimum": 0
          },
          "births": {
            "type": "integer",
            "minimum": 0
          },
          "deaths": {
            "type": "integer",
            "minimum": 0
          },
          "movements": {
            "type": "integer",
            "minimum": 0
          }
        },
        "required": [
          "month",
          "population",
          "females",
          "males",
          "births",
          "deaths",
          "movements"
        ],
        "additionalProperties": false
      },
      "minItems": 2
    },
    "final_animals": {
      "type": "array",
      "items": {
        "type": "object",
        "properties": {
          "id": {
            "type": "string",
            "minLength": 1
          },
          "sex": {
            "enum": [
              "female",
              "male"
            ]
          },
          "age_months": {
            "type": "integer",
            "minimum": 0
          },
          "patch_id": {
            "type": "string",
            "minLength": 1
          },
          "alive": {
            "type": "boolean"
          },
          "settled": {
            "type": "boolean",
            "description": "True only for a living female holding a territory at the endpoint. False for males, unsettled females, and dead animals."
          }
        },
        "required": [
          "id",
          "sex",
          "age_months",
          "patch_id",
          "alive",
          "settled"
        ],
        "additionalProperties": false,
        "allOf": [
          {
            "if": {
              "properties": {
                "settled": {
                  "const": true
                }
              },
              "required": [
                "settled"
              ]
            },
            "then": {
              "properties": {
                "sex": {
                  "const": "female"
                },
                "alive": {
                  "const": true
                }
              }
            }
          }
        ]
      },
      "minItems": 0
    },
    "persisted": {
      "type": "boolean"
    },
    "assumptions": {
      "type": "array",
      "items": {
        "type": "string",
        "minLength": 1
      },
      "minItems": 1
    }
  },
  "required": [
    "schema_version",
    "run_id",
    "data_kind",
    "seed",
    "revision_round",
    "config",
    "history",
    "final_animals",
    "persisted",
    "assumptions"
  ],
  "allOf": [
    {
      "if": {
        "properties": {"schema_version": {"const": "3.1"}},
        "required": ["schema_version"]
      },
      "then": {
        "properties": {
          "config": {"required": ["settlement_rule"]}
        }
      }
    }
  ],
  "additionalProperties": false
}
