{
  "schema_version": "3.0",
  "run_id": "sample-001",
  "data_kind": "sample",
  "seed": 42,
  "revision_round": 0,
  "config": {
    "schema_version": "2.0",
    "run_id": "sample-001",
    "purpose": "synthetic_experiment",
    "seed": 42,
    "duration_months": 1,
    "start_month": 1,
    "parameters_csv": "data/parameters/iberian_lynx_baseline.csv",
    "parameters_sha256": "0000000000000000000000000000000000000000000000000000000000000000",
    "sources_csv": "data/parameters/sources.csv",
    "sources_sha256": "0000000000000000000000000000000000000000000000000000000000000000",
    "initial_population": {
      "females": 10,
      "males": 10,
      "age_months_min": 36,
      "age_months_max": 96
    },
    "patches": [
      {
        "id": "A",
        "area_km2": 100,
        "habitat_quality": 1.0
      },
      {
        "id": "B",
        "area_km2": 100,
        "habitat_quality": 1.0
      }
    ],
    "food_rabbits_per_ha": 4.6,
    "persistence_rule": "settled_breeding_pair_same_patch_at_end",
    "model_conventions": "proposed-2026-10-22",
    "male_patch_crossing_probability": 0.1,
    "parameter_overrides": {}
  },
  "history": [
    {
      "month": 0,
      "population": 20,
      "females": 10,
      "males": 10,
      "births": 0,
      "deaths": 0,
      "movements": 0
    },
    {
      "month": 1,
      "population": 20,
      "females": 10,
      "males": 10,
      "births": 0,
      "deaths": 0,
      "movements": 0
    }
  ],
  "final_animals": [
    {
      "id": "female-01",
      "sex": "female",
      "age_months": 37,
      "patch_id": "A",
      "alive": true,
      "settled": true
    },
    {
      "id": "female-02",
      "sex": "female",
      "age_months": 37,
      "patch_id": "A",
      "alive": true,
      "settled": true
    },
    {
      "id": "female-03",
      "sex": "female",
      "age_months": 37,
      "patch_id": "A",
      "alive": true,
      "settled": true
    },
    {
      "id": "female-04",
      "sex": "female",
      "age_months": 37,
      "patch_id": "A",
      "alive": true,
      "settled": true
    },
    {
      "id": "female-05",
      "sex": "female",
      "age_months": 37,
      "patch_id": "A",
      "alive": true,
      "settled": true
    },
    {
      "id": "female-06",
      "sex": "female",
      "age_months": 37,
      "patch_id": "B",
      "alive": true,
      "settled": true
    },
    {
      "id": "female-07",
      "sex": "female",
      "age_months": 37,
      "patch_id": "B",
      "alive": true,
      "settled": true
    },
    {
      "id": "female-08",
      "sex": "female",
      "age_months": 37,
      "patch_id": "B",
      "alive": true,
      "settled": true
    },
    {
      "id": "female-09",
      "sex": "female",
      "age_months": 37,
      "patch_id": "B",
      "alive": true,
      "settled": true
    },
    {
      "id": "female-10",
      "sex": "female",
      "age_months": 37,
      "patch_id": "B",
      "alive": true,
      "settled": true
    },
    {
      "id": "male-01",
      "sex": "male",
      "age_months": 37,
      "patch_id": "A",
      "alive": true,
      "settled": false
    },
    {
      "id": "male-02",
      "sex": "male",
      "age_months": 37,
      "patch_id": "A",
      "alive": true,
      "settled": false
    },
    {
      "id": "male-03",
      "sex": "male",
      "age_months": 37,
      "patch_id": "A",
      "alive": true,
      "settled": false
    },
    {
      "id": "male-04",
      "sex": "male",
      "age_months": 37,
      "patch_id": "A",
      "alive": true,
      "settled": false
    },
    {
      "id": "male-05",
      "sex": "male",
      "age_months": 37,
      "patch_id": "A",
      "alive": true,
      "settled": false
    },
    {
      "id": "male-06",
      "sex": "male",
      "age_months": 37,
      "patch_id": "B",
      "alive": true,
      "settled": false
    },
    {
      "id": "male-07",
      "sex": "male",
      "age_months": 37,
      "patch_id": "B",
      "alive": true,
      "settled": false
    },
    {
      "id": "male-08",
      "sex": "male",
      "age_months": 37,
      "patch_id": "B",
      "alive": true,
      "settled": false
    },
    {
      "id": "male-09",
      "sex": "male",
      "age_months": 37,
      "patch_id": "B",
      "alive": true,
      "settled": false
    },
    {
      "id": "male-10",
      "sex": "male",
      "age_months": 37,
      "patch_id": "B",
      "alive": true,
      "settled": false
    }
  ],
  "persisted": true,
  "assumptions": [
    "Hand-authored sample; no simulation or biological validation has run.",
    "Patch areas, habitat scores and equal allocation are illustrative assumptions.",
    "Starting females hold five territories in each patch; males use no female slots. Food is excluded from endpoint persistence eligibility.",
    "The final states are illustrative fixtures, not a run of the mixed-age configuration."
  ]
}
